{
  "schema": "reddit.manual_handoff.v1",
  "userId": "user_1",
  "creator": {
    "id": "creator_larissa",
    "name": "Larissa"
  },
  "account": {
    "id": "reddit_account_1",
    "username": "u/Serious_material571"
  },
  "destination": {
    "subreddit": "r/example",
    "canonicalUrl": "https://www.reddit.com/r/example/"
  },
  "asset": {
    "id": "asset_1",
    "sourceFamilyId": "family_1",
    "perceptualFingerprint": "pdq:fixture",
    "perceptualClusterId": "cluster_1",
    "mediaUrl": "https://media.example.com/asset_1.jpg",
    "mediaSha256": "aaaaaaaaaaaaaaaaaaaaaaaaaaaaaaaaaaaaaaaaaaaaaaaaaaaaaaaaaaaaaaaa",
    "mediaType": "image"
  },
  "content": {
    "title": "weekend mood",
    "firstComment": null,
    "nsfw": false,
    "spoiler": false,
    "flair": null
  },
  "rules": {
    "snapshot": {
      "allowedMediaTypes": ["image"],
      "minimumSpacingMinutes": 30
    },
    "snapshotHash": "bbbbbbbbbbbbbbbbbbbbbbbbbbbbbbbbbbbbbbbbbbbbbbbbbbbbbbbbbbbbbbbb",
    "reviewedAt": "2026-07-30T22:00:00Z",
    "reviewedBy": "operator",
    "reviewApproved": true,
    "verificationEvidence": {
      "status": "verified"
    },
    "accountRestrictionState": "active"
  },
  "scheduling": {
    "scheduledFor": "2026-07-31T13:00:00Z",
    "windowStart": "2026-07-31T13:00:00Z",
    "windowEnd": "2026-07-31T13:30:00Z",
    "spacingMinutes": 15,
    "queuePosition": 1,
    "dailyTarget": 8
  },
  "approval": {
    "fingerprint": "cccccccccccccccccccccccccccccccccccccccccccccccccccccccccccccccc",
    "receipt": {
      "schema": "campaign_factory.reddit_task_approval.v1",
      "decision": "approved",
      "approvedBy": "operator",
      "approvedAt": "2026-07-30T22:04:00Z",
      "binding": {
        "accountUsername": "u/Serious_material571",
        "subreddit": "r/example",
        "title": "weekend mood"
      },
      "bindingFingerprint": "cccccccccccccccccccccccccccccccccccccccccccccccccccccccccccccccc",
      "sourceCreativeApprovalId": "creative_approval_1",
      "sourceCreativeApprovalFingerprint": "ffffffffffffffffffffffffffffffffffffffffffffffffffffffffffffffff"
    }
  },
  "reuseException": null,
  "trendBrief": null,
  "idempotencyKey": "dddddddddddddddddddddddddddddddddddddddddddddddddddddddddddddddd",
  "exportFingerprint": "eeeeeeeeeeeeeeeeeeeeeeeeeeeeeeeeeeeeeeeeeeeeeeeeeeeeeeeeeeeeeeee",
  "exportedAt": "2026-07-30T22:05:00Z"
}
